{
  "schemaVersion": 1,
  "review_id": "rr-0002-clinical-2",
  "role": "clinical-2",
  "moduleId": "cbc_suite_v1",
  "subjectContentHash": "sha256:b9b8b64fae56f3a3c9e6b03fb38413c76439d80d73532675695f06543c544cf8",
  "previousRecordHash": "sha256:7a4fcb099f1fb8286d42a79b6bfba07729223528345b7af8fb8d38b70fb34e8d",
  "supersedes": null,
  "reviewerId": "synthetic-reviewer-clinical-2-01",
  "decision": "approve",
  "rationale": "Synthetic dry-run fixture (P1-T2) exercising the clinical-2 role act shape; not a real clinical review.",
  "reviewedAt": "2026-07-21T14:05:00Z",
  "synthetic": true,
  "signature": {
    "algorithm": "ed25519",
    "keyId": "TESTKEY-ef-e1-p1t2-0002",
    "value": "ZmFrZS1zaWduYXR1cmUtdmFsdWUtcnItMDAwMi1jbGluaWNhbC0y"
  }
}
